{"$schema":"https://json-schema.org/draft/2020-12/schema","$id":"https://anomaly.local/gmcp-contract/1.0.0/Anomaly.Char.Stats.json","title":"Anomaly.Char.Stats","description":"Snapshot of everything the character's stats come to. AC/DR are stored in tenths; shown = tenths / 10 as the stat line shows it.","x-direction":"s2c","x-frozen":false,"type":"object","properties":{"stats":{"type":"object","properties":{"strength":{"type":"object","properties":{"base":{"type":"integer"},"current":{"type":"integer"}},"required":["base","current"],"additionalProperties":false},"intellect":{"type":"object","properties":{"base":{"type":"integer"},"current":{"type":"integer"}},"required":["base","current"],"additionalProperties":false},"willpower":{"type":"object","properties":{"base":{"type":"integer"},"current":{"type":"integer"}},"required":["base","current"],"additionalProperties":false},"agility":{"type":"object","properties":{"base":{"type":"integer"},"current":{"type":"integer"}},"required":["base","current"],"additionalProperties":false},"health":{"type":"object","properties":{"base":{"type":"integer"},"current":{"type":"integer"}},"required":["base","current"],"additionalProperties":false},"charm":{"type":"object","properties":{"base":{"type":"integer"},"current":{"type":"integer"}},"required":["base","current"],"additionalProperties":false}},"required":["strength","intellect","willpower","agility","health","charm"],"additionalProperties":false},"ac":{"type":"object","properties":{"tenths":{"type":"integer"},"shown":{"type":"integer"}},"required":["tenths","shown"],"additionalProperties":false},"dr":{"type":"object","properties":{"tenths":{"type":"integer"},"shown":{"type":"integer"}},"required":["tenths","shown"],"additionalProperties":false},"magicResist":{"type":"integer"},"accuracy":{"type":"integer"},"dodge":{"type":"integer"},"crits":{"type":"integer"},"maxDamage":{"type":"integer"},"perception":{"type":"integer"},"stealth":{"type":"integer"},"thievery":{"type":"integer"},"traps":{"type":"integer"},"picklocks":{"type":"integer"},"tracking":{"type":"integer"},"spellcasting":{"type":"integer"},"martialArts":{"type":"integer"},"backstab":{"type":"object","properties":{"min":{"type":"integer"},"max":{"type":"integer"},"accuracy":{"type":"integer"}},"required":["min","max","accuracy"],"additionalProperties":false},"speed":{"type":"integer"},"energy":{"type":"integer"},"resists":{"type":"object","properties":{"fire":{"type":"object","properties":{"value":{"type":"integer"},"heals":{"type":"boolean","description":"true when value > 100: that element heals the character"}},"required":["value","heals"],"additionalProperties":false},"cold":{"type":"object","properties":{"value":{"type":"integer"},"heals":{"type":"boolean","description":"true when value > 100: that element heals the character"}},"required":["value","heals"],"additionalProperties":false},"lightning":{"type":"object","properties":{"value":{"type":"integer"},"heals":{"type":"boolean","description":"true when value > 100: that element heals the character"}},"required":["value","heals"],"additionalProperties":false},"stone":{"type":"object","properties":{"value":{"type":"integer"},"heals":{"type":"boolean","description":"true when value > 100: that element heals the character"}},"required":["value","heals"],"additionalProperties":false},"water":{"type":"object","properties":{"value":{"type":"integer"},"heals":{"type":"boolean","description":"true when value > 100: that element heals the character"}},"required":["value","heals"],"additionalProperties":false}},"required":["fire","cold","lightning","stone","water"],"additionalProperties":false},"regen":{"type":"object","properties":{"hp":{"type":"integer"},"mana":{"type":"integer"}},"required":["hp","mana"],"additionalProperties":false}},"required":["stats","ac","dr","magicResist","accuracy","dodge","crits","maxDamage","perception","stealth","thievery","traps","picklocks","tracking","spellcasting","martialArts","backstab","speed","energy","resists","regen"],"additionalProperties":false}
