{"stats":{"strength":{"base":70,"current":70},"intellect":{"base":40,"current":40},"willpower":{"base":45,"current":45},"agility":{"base":55,"current":55},"health":{"base":65,"current":65},"charm":{"base":40,"current":40}},"ac":{"tenths":240,"shown":24},"dr":{"tenths":45,"shown":4},"magicResist":52,"accuracy":61,"dodge":9,"crits":2,"maxDamage":1,"perception":48,"stealth":0,"thievery":0,"traps":0,"picklocks":0,"tracking":0,"spellcasting":0,"martialArts":0,"backstab":{"min":0,"max":0,"accuracy":0},"speed":100,"energy":1000,"resists":{"fire":{"value":0,"heals":false},"cold":{"value":0,"heals":false},"lightning":{"value":0,"heals":false},"stone":{"value":0,"heals":false},"water":{"value":0,"heals":false}},"regen":{"hp":3,"mana":0}}
